sentence1,sentence2
"Ker ji obveznosti med tednom odrežejo znaten kos časa, običajno med zobe ponese enostavne jedi.","Lemmlina niso obsodili kot pobudnika in povzročitelja zločina, ampak kot juda, zato so ga obesili, služkinja je lagala, torej je morala bili kazen povezana z njenim grehom in so ji odrezali jezik, krščansko vdovo Mühleisin je svet sicer neusmiljeno obsodil na zazidanje pri živem telesu, vendar jo je vladar pomilostil."
6 Z ostrim nožem zarežemo okrog florentincev in jih poberemo s papirja za peko.,"Franček Kramer, dopisnik Večera s Celjskega, in urednica Radia Velenje Mira Zakošek sta pridna člana Društva novinarjev Slovenije aktiva Celje, vsak v svoji sredini pa veljata za marljiva in, če je treba, tudi ostra novinarja."
"Hranijo se z ribami, ki jih lovijo s svojimi dolgimi in ostrimi kljuni.","Ko sem fotografijo razvil, je bila tako ostra, da je vidna vsaka nitka na očetovem puloverju."
"Obenem pa je avtor mojster briljantnega, jasnega in jedrnatega dialoga, napolnjenega z nesentimentalnim humorjem in ostrim, na trenutke celo brutalnim tonom.","Dobavitelji morajo biti kvalitetni in zanesljivi, LIP in Jelovica sta pri tem uspela, v ostrem konkurenčnem boju pa seveda ni lahko vzdržati."
"Kako postaviti senco, kolikšna je njena nasičenost in kako ostra naj bo, je stvar preizkušanja.","Prikličite si v zavest slike in spomine, ki vam predstavljajo element zraka: sprehod ob morju, med katerim se zaganja v vas oster veter, rahel poletni vetrič, ki premika drevesne krošnje, čisti zrak zgodaj zjutraj nekje na prostem v naravi."
"Lizbona – Volilni upravičenci na Portugalskem so na referendumu že drugič v manj kot desetletju odločali o omilitvi zakonodaje glede splavov, ki je sicer ena najostrejših v Evropi.","VELENJE S tovornega avtomobila, ki ga je 45-letni D. J. iz Ljubljane vozil od Mislinje proti Velenju, je v ostrem ovinku pred Velenjem padel tovor."
"Pred leti sem bil na dopustu v Črni gori z avtobusom in ko smo se vračali iz dopusta, je bilo zadnjih 100 km zelo kritičnih kar se vožnje šoferja avtobusa tiče, bila ga je cesta polna, ostri hitri zavoji da sem že ga hotel zamenjati za volanom, (sem poklicni šofer)!","Gospod Cvenkelj me je prebodel s tako ostrim pogledom, da me je obšla slabost."
"Sveta Brigita Švedska, ena največjih mističark poznega srednjega veka, pravi, da je Marija kot perunika čudoviti cvet ostrih listov, ki pomenijo bridko bolečino njenega srca.","Zahtevati nameravajo ostrejšo kontrolo govejega mesa, ki prihaja z britanskih otokov, da bi ugotovili, ali ni okuženo z boleznijo norih krav ali BSE."
"Kmalu po osvojitvi naslova sta namreč svetlolaso lepotičko, zase še vedno pravi, da je preprosto dekle iz Komende pri Ljubljani, opazila Alen Kobilica in agencija Bronz.",Sredi aprila se je 1. zavezniška armada pod poveljstvom britanskega generala Kenetha Andersona pripravljala na osvojitev Tunisa.
"Osrednji del predmeta je posvečen osvojitvi osnovnih metod, orodij in gradnikov, ki jih potrebujemo, da lahko gradimo sisteme vodenja.","V prepričanju, da se vrednost osvajane dame odraža v trudu, ki ste ga vložili v osvojitev nasmeha ali poljuba."
"Recimo, da so imeli templjarji načrt za osvojitev sveta in da so poznali skrivnost nekega neznanskega vira moči, skrivnost, za katero je bilo vredno žrtvovati vso četrt Templja v Parizu, komende, razsejane po vsem kraljestvu in v Španiji, na Portugalskem, v Angliji in Italiji, gradove v Sveti deželi, vse denarno bogastvo, skratka vse …","Glavni aduti bodo zgodnje vstajanje, primerna obutev in oprema ter cilj: osvojitev izbranih vrhov."
"Osvojitev matematičnih orodij za študij tehniške mehanike, sposobnost razumevanja mehanskih zakonitosti in principov v mehaniki materialov in delovanju naprav, sposobnost nadgrajevanja osnovnih modelov s specifičnimi in razvijanje deduktivnega reševanja problemov na področju tekstilne tehnologije.","Zaradi tega so se možnosti za osvojitev kolajne v moški konkurenci precej zmanjšale, vendar nismo obupali, temveč smo v vsako tekmo vložili vse naše adute."
Razstava nosi ime 60 let rokometa v Celju in podnaslov Od začetkov igranja rokometa in ustanovitve kluba do osvojitve naslova evropskih klubskih prvakov.,"Naj nam bo razsodnik zgodovina našega lastnega naroda. že več kakor 600 let od Osvojitve naprej se veselimo nepretrganega zapovrstja kraljev na prestolu, kar je veliko dlje, kot bi lahko obstajala katerakoli ljudska država."
"Za Nymburk pa nisem rekel, da so slabi, nikakor pa niso favoriti za osvojitev lige.","Legendarna jugoslovanska alpinistična himalajska odprava Everest 1979, ki jo je vodil Tone Škarja, sestavljalo pa 25 vrhunskih alpinistov (21 iz Slovenije, 4 iz republik nekdanje Jugoslavije), si je za cilj zadala osvojitev vrha po nepreplezani, prvenstveni smeri po Zahodnem grebenu."
"Osvojitev slednjih poteka prek čustvenih vezi, omogočajo pa ustrezno obliko odnosov.",Darej je napravil velik načrt za osvojitev celotnega črnomorsko-kaspijskega področja od spodnje Donave do Jaksarta (Sir Darje) v srednji Aziji.
Desetarji se zaprejo v sobo in jih ni kakšnih deset minut na spregled.,"Takoj sem zaprl vsa vrata in okna, prižgal svetilko, pobral papirje, jih uredil in pospravil na mizo."
"Zaprl je težka mahagonijeva vrata, se malce odmaknil in jih pogledal.",Wallander se je s skodelico kave vrnil s svojo pisarno in zaprl vrata za sabo.
Spomladi od Višnje Gore do Bregane cestarji zaprli blizu 100 črnih priključkov na dolenjki - Ždinja vas želi legalizacijo črnega priključka - V vas višja vozila ne morejo - S tem bi tudi razbremenili center Novega mesta,"Kljub temu so pot nadaljevali, vendar so jih v Vicenzi zajeli, jim pobrali kovčke z denarjem, njih pa zaprli."
"4 Strjenko nalijemo v vroče sterilizirane kozarce, jih zapremo ter postavimo v hladilnik.","Če človeku prinesemo hrano na mizo in ne bo jedel,potem je vse zaman.Budisti zaprejo vsa čutila zoper sodobnega sveta in se usmerijo k samemu sebi(kopija univerzalnega boga),da rastejo duhovno,ker na zunaj vlada kaos,velika iluzija napram božjem,pravijo ji Maha Maja."
"Le mimogrede, zapori na Povšetovi ulici v Ljubljani ga še dandanšanji nimajo in nič ni slišati, da bi jih zato nameravali zapreti.","Kakšen bo izid, se še ne ve, vsekakor pa bi bila prava sramota zapreti muzej - ne glede na to, kako pomemben je."
"V nediejo v Gorenjem Tarbiju se zapre Burnjak, ki je biu lietos buj liep, buj bogat s kulturno an z materialno ponudbo (od srečanj an koncertov do jabuk, kostanja an domačih dobruot, ki so jih skuhale an spekle sriedenjske gaspodinje), biu je tudi buj obiskan, saj je parklicu tudi vič ljudi ko vsa lieta nazaj tudi kadar nas je bluo na doplih po naših dolinah.","»Oskrbnik mi je povedal, da so se člani družine zbirali tukaj pri maši, duhovnik pa si ni upal iti na prosto, da ga ne bi videli in zaprli ter obglavili.«"
"sama pa je govorila za jeleno karleušo da ji gre na živce in da ponavlja za njo,in da naj se karleuša oglas takrat k bo napovnla dvorano tko k ona..no pa naj zdej zapre gobc kr ponavla skeno za jeleno karleušo","V spalnici sem naletel na skrivnostne ribiške vrvice, za katere mislim, da so pripadale konstrukciji, ki mu je omogočala, da je spalnično okno zaprl iz postelje."
"Leta 1996 so med prvimi malimi podjetji pridobili standard kakovosti ISO 9001 in nadgradili razvojni oddelek, v katerem je nastal niz informacijskih platform za uporabo možnosti tehnologij, povezanih z mobilno telefonijo in telekomunikacijami.",»Oče mi je povedal… da iz kletnih prostorov vodijo navzgor… stopnice…po katerih so se svečeniki povzpeli na platformo…templja.«
"Zato je nelogična in neutemeljena njegova zahteva naročniku, da pri razvoju dovoli uporabo NET platforme, čeprav že iz njegovih revizijskih navedb izhaja, da NET platforma ni neodvisna od blagovne znamke dobaviteljev strojne opreme in operacijskih sistemov in programske opreme.","Razvoj platforme je del projekta IJEPEG-UMKI / ePlatforma , ki ga je delno podprla Evropska Unija ."
"In v teh nekaj mesecih našega obstoja smo navezali stike z mnogimi inštitucijami in rada bi vas obvestila, da se zelo intenzivno pripravlja na evropskem nivoju neka organizacijska oblika, ki naj bi delovala v okviru Evropske unije, to je evropska platforma spomina in vesti, ki naj bi se ukvarjala s povezovanjem in sodelovanjem podobnih inštitucij kot je naša in naj bi prišlo do ustanovitve vseevropskega dokumentacijskega oziroma spominskega centra za žrtve vseh totalitarnih režimov.","Nič novega pravzaprav, saj je s takšnimi lepo zvenečimi in dovolj praznimi obljubami, ki si jih je z željami lahko napolnil vsak sprememb željni volivec, uspelo že marsikomu, zadnjič pa je s takšno politično »platformo« leta 1992 zmagal demokrat Bill Clinton."
"Vlagatelj v revizijskih navedbah namreč navaja, da v kolikor bi naročnik imel operacijski sistem JAVA, bi bilo logično, da zahteva uporabo J2EE platforme, saj NET platforme ni mogoče uporabljati na JAVA operacijskih sistemih.","In umetnost je izbrala tudi Sašo Šavel, ustvarjalko oddaje Platforma, novinarko kulturne redakcije v naši hiši."
"Javna platforma v skupnost združuje ustvarjalke in ustvarjalce različnih področij kreativnih industrij in umetnosti; fotografije, videofilma in animacije ter novih medijev.","Omrežje je platforma, na katero lahko obesimo prav vse tehnologije in vsebine."
Koncern je pionirsko pot za projekt s skupno platformo A00 prepustil Seatu z modelom Arosa.,"Kljub medosni razdalji 272,5 cm - peugeot 407 temelji na PSA-jevi platformi za velike avtomobile kot je na primer citroen C5 - je prostor dokaj omejen po višini, ob višjeraslem vozniku pa tudi za kolena."
"ZA: Applov cenovno najdostopnejši prenosnik iBook je z Intelovo platformo dobil naslednika, ki sliši na ime MacBook.","B & N mora storitveno ponudbo razširiti tudi na druge naprave in seveda mobilne platforme, kakršni sta Windows Phone 7 in Moblin, saj bo samo tako svojim storitvam ustvaril dodano vrednost."
"NHXCHXIzolacija in plašč iz omrežnege, brez halogenih elementov, mešanice po-limerov (HX)","2 Če imamo koga v bližini, skupaj z njim dobro podprimo pasje telo in ga premestimo na odejo ali plašč."
"Mimogrede je oplazila več starih plaščev, ki so togo viseli s kljuk, potem pa jo je grobo izvrglo na sorazmerno svetlobo.","Še preden je filma konec, zaključna špica se še ni odvrtela, Petra že vstaja in oblači plašč, medtem ko jaz med iztekajočimi napisi rad še malo pomolčim in razmislim kakšno malenkost, v glavi ponovim kakšen kader, kakšno sekvenco..."
"Zunaj lahko lije dež, lahko pridejo znanci v hladnih plaščih, ni se pripravljen niti premakniti.","SLEKEL SI JE PLAŠČ, ODPRL OKNO IN POGLEDAL VEN V STARI VODNI STOLP."
"Obleka Armani, Dunhill majica, kravata Versace, pas Ferragamo, Givenchy nogavice, Louis Voitton očala, Yves Saint Laurent plašč iz kašmirja in šal Burberry, vse ponaredki.","Kako je mraz, je zabrbrala in se zavila v ovratnik plašča."
"Odločno je stala na svojem mestu, v bež salonarjih in rjavem plašču prek tenkega rumenega puloverja.","Globine rovov ne moremo meriti, zato za ugotavljanje velikosti napake preštejemo število luknjic na plašču sortimenta."
"Nad vrati sta visela star ribiški plašč in oguljen klobuk, obojega že dolgo ni nosil.","Na ovratniku klasičnega volnenega plašča najdemo presenetljive robove, ostre srtaste vzorce na trenčkotu, v kolekciji pa so tudi lahkotne športne hlače za vsakdan."
S Haninega plašča je med prerivanjem ob Kurtovem prihodu odpadel še zadnji gumb in razkril pogled na raztrgano obleko pod njim.,"Mama si slači plašč in medtem bere, kar je zapisano v beležki."
"Imamo amandma odbora za finance in monetarno politiko, vlada ga podpira.","Gledamo širše, gremo v avstralijo, v Argentino in še kam, podpiramo Slovence širom sveta, ignoriramo Štajerce, Belokranjci so pa itak na pol Rvatje!"
"Tudi danes podpira levičarje, dal nam je Pahorja, ki že zaustavlja recesijo, ki so jo povzročili belčki. ***********************************************************************************************************************************",starši morajo podpirati učenje otrok za šolo in komunikacijo med šolo in družino;
"V konkretnem primeru ta ne podpira naročnikove namenske razlage pogoja, saj slednji ne zajema samo besedne zveze »skupna moč«, ki jo ločeno od preostalega besedila razlaga naročnik, ampak tudi v nadaljevanju pogoja podano besedilo »najmanj 2,5 MWel na objekt«.","On: Obkroženi boste z osebami, ki bodo podpirale vaše ideje in načrte."
"Služi kot razločevalec, kot vizualni označevalec kulturnih in družbenih razlik, v njem pa se odraža okolje z vsemi viri, ki so za izdelavo oblačil primerni in so na razpolago, v prepletu s tehničnim razvojem, ki podpira izdelavo oblačil, in s kulturnimi standardi, ki določajo praktične in estetske norme in ideje.",In kot so pokazale zadnje raziskave še vedno večina podpira gadafija saj je tudi vojska že skoraj prevzela oblast nad libijo...
"Ukaz sndconfig uporablja za nastavljanje jedra, da podpira zvok naložljive module, ki se nahajajo v imeniku /lib/modules/2.0.31/misc.","To poglavje je idiosinkratičen poskus te zadnje vrste, ki ga za povrh ne podpira nobena posebna študija o Maorih ali filozofih (zlasti Hobbesu in Rousseauju), ki jih spotoma omenjam."
"Varuh človekovih pravic Republike Slovenije se zaveda, da odgovorno obnašanje institucije vključuje tudi okolju prijazno poslovanje, zato podpira aktivnosti, ki vodijo k temu cilju.","Podpiram tudi to, da bi čimprej prišlo do oblikovanja in sprejemanja tega, kar bi se imenovalo nacionalni program izobraževanja odraslih in pa oblikovanje standardov in normativov za to dejavnost, ki bi omogočilo po eni strani lahko to, da bi se v to izobraževanje, še bolj kot doslej, vključevali tudi drugi, ne le na eni strani ljudske univerze, na drugi strani pa zasebniki z različnimi oblikami, ampak tudi drugi subjekti."
"Tudi zaradi zgodovinske in estetske vrednosti kandidatk podpiram njihovo članstvo, saj bi s tem prvič postali tudi bolj pozorni na kulturno dimenzijo Evrope, ki je bila doslej zanemarjena.","Še enkrat z grenkobo ugotavljam, da sem marca imel prav, da danes to ne pomaga povsem nič, kajti čas, ko bi to lahko storili je minil, da pa je danes treba ta zakon obravnavati z vidika novih okoliščin in da ga jaz, takega kot je, ne podpiram."
"Malce brskajte po radijskih postajah, nekje ustavite frekvenco in vprašajte sopotnike, kdo prvi ugotovi izvajalca.","Ogled železnice: ZPM organizira obisk mariborske železniške postaje, kjer si bodo mladostniki ogledali lokomotive in se spoznali z delovanjem kretnic."
Na ranžirnem kolodvoru porazdelitve tveganja so posebno priljubljene postaje v »slabo razvitih provincialnih gnezdih«.,"Režiserju in soustvarjalcem je uspelo v dobro poldrugo uro domišljeno zgoščenega, notranje intenzivnega in stopnjevanega dogajanja zaobjeti ključne postaje duševno ponotranjenega križevega pota »bivšega študenta« in nesrečnega morilca Rodiona Romanoviča Raskolnikova, in sicer od fragmentarno oživljenih družinskih oz. življenjskih okoliščin, ki so v medsebojnem družbenem součinkovanju (lahko) privedle do zločina, do posledičnega protagonistovega bolezenskega stanja, nenadzorovanih duševnih blodenj in telesnega trpljenja, ter njegovega zaključnega javnega priznanja zločina in (domnevnega) očiščenja."
"blejala pred postajo metroja, s postaje metroja, v postajo metroja, policisti so dajali luč s sireno in na trgu","Aleš uperi prst tudi proti nacionalki, ki prikazuje premalo oddaj z glasbo, ki ni narodnozabavna, in komercialnim radijskim postajam, ki se oglašujejo s tem, da predvajajo glasbo po željah poslušalcev."
"Na varnem na postaji je ves pretresen povedal, da ga je napadel eden od majhnih dlakavih ljudi.","Čeprav prvotno zbornica ni imela tovrstnih namenov, saj bi našim strokovnim službam, testnim postajam in osemenjevalnim centrom ustrezala trdna pogodba z krovno govedorejsko organizacijo o izvajanju nalog na tem področju, pa je sedaj zaradi odgovornosti, ki jo imamo pred vsemi Vami in tudi drugimi člani, to obvezana narediti."
"Ameriški igralec je večji del minule srede preživel na policijski postaji v severovzhodni ameriški državi Vermont, kamor so ga pripeljali zaradi prehitre vožnje.","1974 - Kmetijsko veterinarski zavod Nova Gorica po priključitvi veterinarskih postaj: Vipava, Idrija, Nova Gorica ter v kasnejših letih še veterinarske postaje:Tolmin, Ajdovščina in Postojna"
"Ob 8.50 nas bo muzejski vlak odpeljal z Jesenic, mimo Bleda in Bohinja proti končni postaji Kanal.","Barry je rekel, da bo v pelerini počakal na postaji in pomahal z baterijo, ko bo pripeljal avtobus, da ne bodo vsi do kože premočeni."
"s tem namenom je zgrajen nov objekt Policijske postaje (PP) v Brežicah, na prostoru tovarne Jutranjka. na","naprava za sprejemanje in beleženje radijskih valov, ki jih oddajajo vesoljski radijski izviri; sestoji iz ene ali več anten, povezanih z ojačevalniki in sprejemniki; ti sprejeto valovanje vnesejo v računalnik, ki nato naredi sliko radijskega vira; antene radioteleskopov so podobne zrcalom reflektorjev in so včasih zares zelo velikih razsežnosti, premična antena raziskovalne postaje Jodrell Bank v Angliji ima npr. mrežasto kovinsko zrcalo s premerom 76 m, radioteleskop v Arecibu v Portoriku pa je vgrajen v žrelo ugaslega ognjenika in ima premer okoli 300 m, globino pa 50 m"
"Zakaj se je finomehanik Brane, človek iz bloka, odločil, da bo vsak dan kolesaril - Na Pance po kondicijo in v družbo - Tanja je kar bolna, če vsak dan ne prevozi vsaj dvajset kilometrov","S 60 kW moči lahko proizvede najvišjo hitrost 45 km/h, s katero avtomobil prevozi do 2 km (način EV) ter tako dodatno varčuje z gorivom in ne sprošča emisij CO2."
"Sprint je sicer veleslalomu podobna disciplina, saj tekmovalci najprej prevozijo veleslalomsko progo.","Za pobrat nucano blaguo bojo po foranijah naše pokrajine, an sevieda tudi v naši špietarski foraniji, pomagal “volontari”, pru takuo Kamuni, ki posodejo njih kamjone za prevozit blaguo od naših vasi do Čedada."
Ta ovinek je del šprinterske proge in so ga športniki in športnice prevozili velikokrat že pred začetkom olimpijskih iger.,"Otok je ravno prav velik, da se ga lahko prevozi z avtom v enem dnevu."
"Ljudje, ki prevozijo manj kot 5000 kilometrov na leto, so še posebej izstopali s svojim neznanjem tako na teoretičnem kot na praktičnem področju.","Da se povzpnemo za nekaj sto višinskih metrov, moramo neredko prevoziti sto in več kilometrov od doma do gora."
"S kolikšno povprečno hitrostjo bi moral voziti, da bi to razdaljo prevozil v 2 urah?","On je neuspešno zahteval, da danes postavijo drugačno progo od tiste, ki so jo nekateri včeraj prevozili, jaz pa ne."
"Prevozil sem pol Evrope in našel marsikateri naslov, menda bom našel tudi ta servis.","Zaradi krajevnega policista in v moje veliko olajšanje je prestavil v nižjo in prevozil mestece z dovoljeno hitrostjo, brž ko je zadnja hiša ostala za nama, pa sva spet zdrvela."
"Mi smo se prve kilometre prevozili z najbolje opremljenim, ki ima ob 1,6-litrskem bencinskem motorju med drugim ABS, potovalni računalnik, lita platišča, radio, katerega evropska cena bo blizu 9000 evrov in na nekaj takega (zastopnik Renault-Nissan Slovenija bo uradne cene razkril te dni) bomo morali računati tudi pri nas.","Tam pred Dobravljami, na magistralki, ki jo vsak dan prevozim, je ravno tako ena takšna luknja."
"Pregrešna vrtoglavica ustvarjalnosti, poneverjanja in kraje in izkrivljanja in spreminjanja, vse to je počel vznesen, vrtoglavo zadovoljen odrasel človek s svojo grozečo pokoro in z mačkom, ki opleta z repom.","Eden od psov je koprneče prosil za pozornost, mahal je z repom in bil ves razburjen, zato sem se ustavila in ga popraskala po ušesih."
"Lipidi v bioloških membranah tvorijo dvojno plast, ki je s polarnimi glavami usmerjena navzven in z nepolarnimi repi navznoter.",Bog jo je hitro zgrabil in ji odtrgal rep (iz njega je nato ustvaril Evo).
"Brez svojega dragulja bi pozelenela od zavisti, napihnila bi se od zlobe, zrasli bi ti dlake, kremplji in kačji rep.","Peniculus je pomanjševalnica besede penis (rep, penis) in pomeni hkrati 'repek', 'krtača', 'omelo' (bikov rep je služil za krtačo) in 'majhen penis'."
"V koreografiji M. in V. zaživijo kot en sam organizem, čigar divji ples v krogu samega sebe lovi za rep.«","Komaj dve leti po volitvah se njegova stranka v javnomnenjskih raziskavah uvršča na sam rep lestvice političnih strank, člani Zaresa pa lahko skačejo od veselja, kadar jim kakšna anketa nameri več kot en odstotek podpore med volilci."
"Na pogled je podoben rakunu, saj ima sivo in temnorjavo obročkast rep.","»Sprva smo si želeli, da bi Zavec izzval belgijskega evropskega prvaka Jacksona Oseija Bonsuja (24 zmag, 21 s k. o., 1 poraz), ki pa je stisnil rep med noge in odklonil obračun."
"Tako je na primer seme solate lahko kaljivo še po treh letih, seme fižola, graha in špinače po dveh letih, repa in peteršilj pa kalita samo eno leto.","Lobanja je bila majhna, vrat in rep pa zelo dolga, zanj značilne so bile tudi š tiri zajetne noge."
"Prostorske razmere v slovenskih splošnih knjižnicah kažejo na velike razlike med mesti: Nova Gorica ima denimo na razpolago 83,5 kvadratnega metra na 1000 prebivalcev in je na prvem mestu, Maribor pa je z 22,5 m2 na 1000 prebivalcev povsem na repu med vsemi šestdesetimi slovenskimi splošnimi knjižnicami.","Rep prek hrbta roke zavijte v zanko in pritrdite z veliko iglo, konec repa pa zavijte okrog gumice in dobro utrdite."
Sredi pogajanj je Falcon odstopil z vladnega položaja in se upokojil.,Od pogodbe lahko odstopi v treh mesecih po začetku stečajnega postopka.
"Čez teden dni so ljudje prebrali v domačem časniku, da je odstopil predsednik najbolj vplivne politične organizacije in to zaradi preobremenjenosti.","Simon Špilak, ki je odstopil na 10. kilometru, je dejal: '' Žal sem zbolel."
po tem kako pahor vodi našo državo bi moral že davno odstopit pa mu kaj takega še namisel ne pride pa dirkanje kresalove in ministra za promet kose kar z lučjo vozi po odstavnem pas to je za njih priviligirance normalno gerkeš pa se je raje napil in na ta način je najlaže spregel ker je uvidel da z to barabinsko vlado nemore naprej bravo kose drugi ministri drogirajo in afnajo pa se jim ne zgodi nič očitno se je zameril kresalki in so ga vzeli na piko saj nimamo več policije temveč inkasante,ma ti nepovezani poslanci so kar nekaj..ljudstvo jh je izvolilo na podlagi stranke v kateri so bili in programa in ce poslanec oddide iz stranke bi moral ravno tako odstopiti iz mesta poslanca..
"V helenizmu se je vse spremenilo: književnost je hotela biti učena; ne zato, ker je bila prvič v zgodovini pridržana za elito (tudi Pindar in Ajshil nista bila ravno ljudska pisatelja): toda od svojega občinstva je zahtevala kulturni napor, ki je odlikoval ljubitelje; miti so tedaj odstopili prostor temu, čemur še zdaj pravimo mitologija in kar je preživelo do 18. stoletja.","Tudi sodne zaostanke bi neodvisni kandidat, ki se nima za politika, zmanjšal s svojevrstno teorijo: organiziral bi loterijo, na kateri bi lahko nastopali samo tisti, ki so odstopili od tožbe."
Za to skupinico kanarčkov in njihovih potomcev boste v letu 2005 pač morali odstopiti delček svojega stanovanja.,"Gospod minister, prav je da ste odstopili, nekateri niso in ne dvigajo moralnih standardov."
"Zaradi napak sicer do zdaj noben sodnik ni bil razrešen pred parlamentom, je pa nekaj sodnikom zaradi napak prenehala sodna služba proti njihovi volji, nekateri pa so odstopili, še preden bi bil zoper njih morebiti uveden kakršen koli postopek.","Ta nam je pojasnil, da mora zavod v primeru, ko zavarovanec uveljavlja sodno varstvo, celotno dokumentacijo, na podlagi katere je bilo odločeno o zavarovančevih pravicah iz invalidskega zavarovanja, odstopiti sodišču."
"Ker se sam ni odločil za preparacijo, je trofejo želel odstopiti domači RD Sora, da bi sulec v ribiškem domu še mnogim rodovom loških ribičev govoril o dnevu in ulovu, ki se bo le še stežka ponovil; vendar RD zanjo ni bila zainteresirana.","Že na prvem plovu sta se prekucnila, tako da sta odstopila."
Vlogo za izdajo potnega lista ali osebne izkaznice za otroka vloži njegov starš oz. zakoniti zastopnik na kateri koli upravni enoti.,"Pravna oseba, ki želi pridobiti delnice koncesionarja, mora na Ministrstvo za finance vložiti zahtevo za izdajo soglasja in priložiti zakonsko predpisano dokumentacijo."
"Predvsem pa opažamo, da mnogo upravičencev ni vložilo zahteve za priznanje statusa žrtve povojnega protipravnega odvzema življenja za po vojni pobite starše, brate oziroma sorodnike in na podlagi tega statusa za priznanje statusa svojca žrtve povojnega protipravnega odvzema življenja s pravico do odškodnine.","Napočila je nedelja in s tem dan, ki so se ga veselili, saj so v priprave vložili ogromno truda in kot sta povedala naša sogovornika, so bile vaje v zadnjem obdobju intenzivne, vsakodnevne, kar pa se jim je obrestovalo."
