sentence1,sentence2,oznaka (label)
"Berberskega princa Tarika Ibn Zijada je zaradi samovoljnosti njegov arabski vojaški poveljnik Musa Ibn Musair kaznoval z udarci, nekateri vojaški poveljniki pa so kalifu iz Damaska, za katerega so se udeležili pohoda v Španijo, odpovedali pokorščino.","To najemno razmerje pa ni varovano tako, kot so varovana stanovanjska najemna razmerja, saj ni določeno, da bi denacionalizacijski upravičenci morali skleniti z najemojemalci poslovnih prostorov najemno razmerje za nedoločen čas, ki bi ga lahko odpovedali le iz krivdnih razlogov.",
Trata je ponavadi privlačna prav zaradi svoje razraščenosti torej se ji lahko v majhnem vrtu tudi odpoveste.,"Nadškof je kmalu po imenovanju za pastirja tukajšnje škofije od župnije Sv. Stanislava zahteval, da se odpove svojemu posebnemu statusu, ki ji je omogočal, da sama upravlja s premoženjem.",
"Žal se je, kadar je do pričetka pouka manjkala le še sekunda, tudi sladkosneden gospodar odpovedal prehranjevalnim navadam, z obžalujočim pogledom pobožal polnjene palačinke na polici, hitro srknil požirek mleka in vrata hladilnika zaloputnil z obljubo, da bo vsebino v njem pospravil takoj po pričetku počitnic.","Na šolah so odpovedali pouk, zaprli so vrtce, ulice so dobesedno prazne.",
"Ker ji obveznosti med tednom odrežejo znaten kos časa, običajno med zobe ponese enostavne jedi.","ja tm zadej a jo ne vidte aja sej res sliko so odrezal, zdej pa ne znajo več skp sestavt lol : )",
Blago na notranjih vogalih odrežite in skozi odprtino blazino obrnite na lice.,Z mešanico napolnite vrečko za zamrzovanje in ji odrežite čisto majhen vogal.,
Pri merjenju izpusta strupenih plinov so se avtomobili z bencinskim motorjem odrezali pričakovano bolje od dizelskih.,"Zanimivo bi bilo testirati, kako bi se odrezali tudi vsi ostali nekonformisti …",
"Stebla nikoli ne odlomimo, temveč ga vedno odrežemo (skrajšamo) z ostrim nožem ali škarjami, ki morajo biti popolnoma čiste, da na rastlino ne zanesemo morebitnih bolezenskih klic.","Nekateri nastopi so nam uspeli dobro, nekateri so bili povprečni in nekateri slabi, kot se je odrezala tudi večina nam konkurenčnih reprezentanc.",
"Lemmlina niso obsodili kot pobudnika in povzročitelja zločina, ampak kot juda, zato so ga obesili, služkinja je lagala, torej je morala bili kazen povezana z njenim grehom in so ji odrezali jezik, krščansko vdovo Mühleisin je svet sicer neusmiljeno obsodil na zazidanje pri živem telesu, vendar jo je vladar pomilostil.","Odrežemo cele skupine plodov in jih nekaj dni pustimo v hladilniku, nato jih za dan ali dva damo na sobno temperaturo.",
"Irenine lase so kruto odrezali, jo prevezali tudi prek glave, da je zaslutil strahotne opekline pod bledimi povoji.","»To je zato, ker si se pri informacijskem centru tako dobro odrezal!",
"FOTO 4: Odrežemo vse izrojene veje v notranjosti krošnje, ki zasenčujejo nižje ležeče vitalne rodne veje.","»Spomni se, kaj se je zgodilo perzijskemu Velikemu kralju v času vdora v Grčijo: zgradil je most čez morje, da je spravil svojo vojsko čez Ožino, in s prekopom odrezal polotok z goro Atos, da je po njem priplulo njegovo ladjevje, potem pa je bil kaznovan za svojo nadustost in je doživel hude poraze tako na kopnem kot na morju.«",
"VELENJE S tovornega avtomobila, ki ga je 45-letni D. J. iz Ljubljane vozil od Mislinje proti Velenju, je v ostrem ovinku pred Velenjem padel tovor.","Hranijo se z ribami, ki jih lovijo s svojimi dolgimi in ostrimi kljuni.",
"Še ostrejši je hrvaški poslanec Ivo Škrabalo: opozoril je, da je šel Jurgens v popolnoma napačno smer.","Zahtevati nameravajo ostrejšo kontrolo govejega mesa, ki prihaja z britanskih otokov, da bi ugotovili, ali ni okuženo z boleznijo norih krav ali BSE.",
"Dobavitelji morajo biti kvalitetni in zanesljivi, LIP in Jelovica sta pri tem uspela, v ostrem konkurenčnem boju pa seveda ni lahko vzdržati.","Gospod Cvenkelj me je prebodel s tako ostrim pogledom, da me je obšla slabost.",
"Pred leti sem bil na dopustu v Črni gori z avtobusom in ko smo se vračali iz dopusta, je bilo zadnjih 100 km zelo kritičnih kar se vožnje šoferja avtobusa tiče, bila ga je cesta polna, ostri hitri zavoji da sem že ga hotel zamenjati za volanom, (sem poklicni šofer)!","Prikličite si v zavest slike in spomine, ki vam predstavljajo element zraka: sprehod ob morju, med katerim se zaganja v vas oster veter, rahel poletni vetrič, ki premika drevesne krošnje, čisti zrak zgodaj zjutraj nekje na prostem v naravi.",
"Sveta Brigita Švedska, ena največjih mističark poznega srednjega veka, pravi, da je Marija kot perunika čudoviti cvet ostrih listov, ki pomenijo bridko bolečino njenega srca.","Kako postaviti senco, kolikšna je njena nasičenost in kako ostra naj bo, je stvar preizkušanja.",
6 Z ostrim nožem zarežemo okrog florentincev in jih poberemo s papirja za peko.,"Lizbona – Volilni upravičenci na Portugalskem so na referendumu že drugič v manj kot desetletju odločali o omilitvi zakonodaje glede splavov, ki je sicer ena najostrejših v Evropi.",
"Franček Kramer, dopisnik Večera s Celjskega, in urednica Radia Velenje Mira Zakošek sta pridna člana Društva novinarjev Slovenije aktiva Celje, vsak v svoji sredini pa veljata za marljiva in, če je treba, tudi ostra novinarja.","Obenem pa je avtor mojster briljantnega, jasnega in jedrnatega dialoga, napolnjenega z nesentimentalnim humorjem in ostrim, na trenutke celo brutalnim tonom.",
"Kmalu po osvojitvi naslova sta namreč svetlolaso lepotičko, zase še vedno pravi, da je preprosto dekle iz Komende pri Ljubljani, opazila Alen Kobilica in agencija Bronz.","Zaradi tega so se možnosti za osvojitev kolajne v moški konkurenci precej zmanjšale, vendar nismo obupali, temveč smo v vsako tekmo vložili vse naše adute.",
Darej je napravil velik načrt za osvojitev celotnega črnomorsko-kaspijskega področja od spodnje Donave do Jaksarta (Sir Darje) v srednji Aziji.,"Za Nymburk pa nisem rekel, da so slabi, nikakor pa niso favoriti za osvojitev lige.",
"Glavni aduti bodo zgodnje vstajanje, primerna obutev in oprema ter cilj: osvojitev izbranih vrhov.",Razstava nosi ime 60 let rokometa v Celju in podnaslov Od začetkov igranja rokometa in ustanovitve kluba do osvojitve naslova evropskih klubskih prvakov.,
"Po osvojitvi naslova najlepše športnice Evrope je povedala, da si želi postati članica hrvaške reprezentance v rokometu, toda zdaj misli drugače.","Osvojitev matematičnih orodij za študij tehniške mehanike, sposobnost razumevanja mehanskih zakonitosti in principov v mehaniki materialov in delovanju naprav, sposobnost nadgrajevanja osnovnih modelov s specifičnimi in razvijanje deduktivnega reševanja problemov na področju tekstilne tehnologije.",
"V prepričanju, da se vrednost osvajane dame odraža v trudu, ki ste ga vložili v osvojitev nasmeha ali poljuba.","Recimo, da so imeli templjarji načrt za osvojitev sveta in da so poznali skrivnost nekega neznanskega vira moči, skrivnost, za katero je bilo vredno žrtvovati vso četrt Templja v Parizu, komende, razsejane po vsem kraljestvu in v Španiji, na Portugalskem, v Angliji in Italiji, gradove v Sveti deželi, vse denarno bogastvo, skratka vse …",
Sredi aprila se je 1. zavezniška armada pod poveljstvom britanskega generala Kenetha Andersona pripravljala na osvojitev Tunisa.,"Osvojitev slednjih poteka prek čustvenih vezi, omogočajo pa ustrezno obliko odnosov.",
"Osrednji del predmeta je posvečen osvojitvi osnovnih metod, orodij in gradnikov, ki jih potrebujemo, da lahko gradimo sisteme vodenja.","Legendarna jugoslovanska alpinistična himalajska odprava Everest 1979, ki jo je vodil Tone Škarja, sestavljalo pa 25 vrhunskih alpinistov (21 iz Slovenije, 4 iz republik nekdanje Jugoslavije), si je za cilj zadala osvojitev vrha po nepreplezani, prvenstveni smeri po Zahodnem grebenu.",
"Le mimogrede, zapori na Povšetovi ulici v Ljubljani ga še dandanšanji nimajo in nič ni slišati, da bi jih zato nameravali zapreti.","V nediejo v Gorenjem Tarbiju se zapre Burnjak, ki je biu lietos buj liep, buj bogat s kulturno an z materialno ponudbo (od srečanj an koncertov do jabuk, kostanja an domačih dobruot, ki so jih skuhale an spekle sriedenjske gaspodinje), biu je tudi buj obiskan, saj je parklicu tudi vič ljudi ko vsa lieta nazaj tudi kadar nas je bluo na doplih po naših dolinah.",
"Če človeku prinesemo hrano na mizo in ne bo jedel,potem je vse zaman.Budisti zaprejo vsa čutila zoper sodobnega sveta in se usmerijo k samemu sebi(kopija univerzalnega boga),da rastejo duhovno,ker na zunaj vlada kaos,velika iluzija napram božjem,pravijo ji Maha Maja.",Desetarji se zaprejo v sobo in jih ni kakšnih deset minut na spregled.,
"sama pa je govorila za jeleno karleušo da ji gre na živce in da ponavlja za njo,in da naj se karleuša oglas takrat k bo napovnla dvorano tko k ona..no pa naj zdej zapre gobc kr ponavla skeno za jeleno karleušo",Spomladi od Višnje Gore do Bregane cestarji zaprli blizu 100 črnih priključkov na dolenjki - Ždinja vas želi legalizacijo črnega priključka - V vas višja vozila ne morejo - S tem bi tudi razbremenili center Novega mesta,
"V spalnici sem naletel na skrivnostne ribiške vrvice, za katere mislim, da so pripadale konstrukciji, ki mu je omogočala, da je spalnično okno zaprl iz postelje.","Takoj sem zaprl vsa vrata in okna, prižgal svetilko, pobral papirje, jih uredil in pospravil na mizo.",
Wallander se je s skodelico kave vrnil s svojo pisarno in zaprl vrata za sabo.,"Zaprl je težka mahagonijeva vrata, se malce odmaknil in jih pogledal.",
"»Oskrbnik mi je povedal, da so se člani družine zbirali tukaj pri maši, duhovnik pa si ni upal iti na prosto, da ga ne bi videli in zaprli ter obglavili.«","4 Strjenko nalijemo v vroče sterilizirane kozarce, jih zapremo ter postavimo v hladilnik.",
"Kljub temu so pot nadaljevali, vendar so jih v Vicenzi zajeli, jim pobrali kovčke z denarjem, njih pa zaprli.","Ko se predajate sladkostim odlične čokolade, drage dame, se jim prepustite popolnoma – zaprite oči in pustite, da se pregrešna dobrota v vaših ustih razširi po jeziku, se dotakne kar največ brbončic in še dolgo pusti čisti okus po užitku.",
"Razvoj platforme je del projekta IJEPEG-UMKI / ePlatforma , ki ga je delno podprla Evropska Unija .","Nič novega pravzaprav, saj je s takšnimi lepo zvenečimi in dovolj praznimi obljubami, ki si jih je z željami lahko napolnil vsak sprememb željni volivec, uspelo že marsikomu, zadnjič pa je s takšno politično »platformo« leta 1992 zmagal demokrat Bill Clinton.",
"ZA: Applov cenovno najdostopnejši prenosnik iBook je z Intelovo platformo dobil naslednika, ki sliši na ime MacBook.",»Oče mi je povedal… da iz kletnih prostorov vodijo navzgor… stopnice…po katerih so se svečeniki povzpeli na platformo…templja.«,
"Leta 1996 so med prvimi malimi podjetji pridobili standard kakovosti ISO 9001 in nadgradili razvojni oddelek, v katerem je nastal niz informacijskih platform za uporabo možnosti tehnologij, povezanih z mobilno telefonijo in telekomunikacijami.","Vlagatelj v revizijskih navedbah namreč navaja, da v kolikor bi naročnik imel operacijski sistem JAVA, bi bilo logično, da zahteva uporabo J2EE platforme, saj NET platforme ni mogoče uporabljati na JAVA operacijskih sistemih.",
"B & N mora storitveno ponudbo razširiti tudi na druge naprave in seveda mobilne platforme, kakršni sta Windows Phone 7 in Moblin, saj bo samo tako svojim storitvam ustvaril dodano vrednost.",Koncern je pionirsko pot za projekt s skupno platformo A00 prepustil Seatu z modelom Arosa.,
"Tako ena platforma ne zahteva povsem enake medosne razdalje, kaj šele celega vozila.","Zato je nelogična in neutemeljena njegova zahteva naročniku, da pri razvoju dovoli uporabo NET platforme, čeprav že iz njegovih revizijskih navedb izhaja, da NET platforma ni neodvisna od blagovne znamke dobaviteljev strojne opreme in operacijskih sistemov in programske opreme.",
"Kljub medosni razdalji 272,5 cm - peugeot 407 temelji na PSA-jevi platformi za velike avtomobile kot je na primer citroen C5 - je prostor dokaj omejen po višini, ob višjeraslem vozniku pa tudi za kolena.","Javna platforma v skupnost združuje ustvarjalke in ustvarjalce različnih področij kreativnih industrij in umetnosti; fotografije, videofilma in animacije ter novih medijev.",
"Omrežje je platforma, na katero lahko obesimo prav vse tehnologije in vsebine.","In umetnost je izbrala tudi Sašo Šavel, ustvarjalko oddaje Platforma, novinarko kulturne redakcije v naši hiši.",
"Mama si slači plašč in medtem bere, kar je zapisano v beležki.","Mimogrede je oplazila več starih plaščev, ki so togo viseli s kljuk, potem pa jo je grobo izvrglo na sorazmerno svetlobo.",
"Globine rovov ne moremo meriti, zato za ugotavljanje velikosti napake preštejemo število luknjic na plašču sortimenta.","2 Če imamo koga v bližini, skupaj z njim dobro podprimo pasje telo in ga premestimo na odejo ali plašč.",
S Haninega plašča je med prerivanjem ob Kurtovem prihodu odpadel še zadnji gumb in razkril pogled na raztrgano obleko pod njim.,"SLEKEL SI JE PLAŠČ, ODPRL OKNO IN POGLEDAL VEN V STARI VODNI STOLP.",
"Nad vrati sta visela star ribiški plašč in oguljen klobuk, obojega že dolgo ni nosil.","Zunaj lahko lije dež, lahko pridejo znanci v hladnih plaščih, ni se pripravljen niti premakniti.",
"Še preden je filma konec, zaključna špica se še ni odvrtela, Petra že vstaja in oblači plašč, medtem ko jaz med iztekajočimi napisi rad še malo pomolčim in razmislim kakšno malenkost, v glavi ponovim kakšen kader, kakšno sekvenco...","Na ovratniku klasičnega volnenega plašča najdemo presenetljive robove, ostre srtaste vzorce na trenčkotu, v kolekciji pa so tudi lahkotne športne hlače za vsakdan.",
"Kako je mraz, je zabrbrala in se zavila v ovratnik plašča.","Obleka Armani, Dunhill majica, kravata Versace, pas Ferragamo, Givenchy nogavice, Louis Voitton očala, Yves Saint Laurent plašč iz kašmirja in šal Burberry, vse ponaredki.",
"Glede na to, da srajce navadno ne nosite teden dni zapored, je dobro, da tudi plašč vsak mesec pregledate, ali ni morda že zrel za obisk kemične čistilnice.","NHXCHXIzolacija in plašč iz omrežnege, brez halogenih elementov, mešanice po-limerov (HX)",
In kot so pokazale zadnje raziskave še vedno večina podpira gadafija saj je tudi vojska že skoraj prevzela oblast nad libijo...,"Imamo amandma odbora za finance in monetarno politiko, vlada ga podpira.",
"V konkretnem primeru ta ne podpira naročnikove namenske razlage pogoja, saj slednji ne zajema samo besedne zveze »skupna moč«, ki jo ločeno od preostalega besedila razlaga naročnik, ampak tudi v nadaljevanju pogoja podano besedilo »najmanj 2,5 MWel na objekt«.","Gledamo širše, gremo v avstralijo, v Argentino in še kam, podpiramo Slovence širom sveta, ignoriramo Štajerce, Belokranjci so pa itak na pol Rvatje!",
"Ukaz sndconfig uporablja za nastavljanje jedra, da podpira zvok naložljive module, ki se nahajajo v imeniku /lib/modules/2.0.31/misc.","Še enkrat z grenkobo ugotavljam, da sem marca imel prav, da danes to ne pomaga povsem nič, kajti čas, ko bi to lahko storili je minil, da pa je danes treba ta zakon obravnavati z vidika novih okoliščin in da ga jaz, takega kot je, ne podpiram.",
"Tudi zaradi zgodovinske in estetske vrednosti kandidatk podpiram njihovo članstvo, saj bi s tem prvič postali tudi bolj pozorni na kulturno dimenzijo Evrope, ki je bila doslej zanemarjena.","Nekaj drugega bi pomenilo, če bi se scenaristom v stavki lahko pridružili tudi člani Združenja igralcev, ki jih ti sicer podpirajo, kar se je videlo tudi v njihovi odsotnosti na podelitvi globusov.",
starši morajo podpirati učenje otrok za šolo in komunikacijo med šolo in družino;,"On: Obkroženi boste z osebami, ki bodo podpirale vaše ideje in načrte.",
"Tudi danes podpira levičarje, dal nam je Pahorja, ki že zaustavlja recesijo, ki so jo povzročili belčki. ***********************************************************************************************************************************","Varuh človekovih pravic Republike Slovenije se zaveda, da odgovorno obnašanje institucije vključuje tudi okolju prijazno poslovanje, zato podpira aktivnosti, ki vodijo k temu cilju.",
"Podpiram tudi to, da bi čimprej prišlo do oblikovanja in sprejemanja tega, kar bi se imenovalo nacionalni program izobraževanja odraslih in pa oblikovanje standardov in normativov za to dejavnost, ki bi omogočilo po eni strani lahko to, da bi se v to izobraževanje, še bolj kot doslej, vključevali tudi drugi, ne le na eni strani ljudske univerze, na drugi strani pa zasebniki z različnimi oblikami, ampak tudi drugi subjekti.","Služi kot razločevalec, kot vizualni označevalec kulturnih in družbenih razlik, v njem pa se odraža okolje z vsemi viri, ki so za izdelavo oblačil primerni in so na razpolago, v prepletu s tehničnim razvojem, ki podpira izdelavo oblačil, in s kulturnimi standardi, ki določajo praktične in estetske norme in ideje.",
"Aleš uperi prst tudi proti nacionalki, ki prikazuje premalo oddaj z glasbo, ki ni narodnozabavna, in komercialnim radijskim postajam, ki se oglašujejo s tem, da predvajajo glasbo po željah poslušalcev.","blejala pred postajo metroja, s postaje metroja, v postajo metroja, policisti so dajali luč s sireno in na trgu",
"Darko Gerjevič, ki je bil do sedaj komandir Policijske postaje Brežice, je prevzel naloge vodje Oddelka za splošne policijske naloge v Sektorju uniformirane policije na Policijski upravi Krško.","Čeprav prvotno zbornica ni imela tovrstnih namenov, saj bi našim strokovnim službam, testnim postajam in osemenjevalnim centrom ustrezala trdna pogodba z krovno govedorejsko organizacijo o izvajanju nalog na tem področju, pa je sedaj zaradi odgovornosti, ki jo imamo pred vsemi Vami in tudi drugimi člani, to obvezana narediti.",
"s tem namenom je zgrajen nov objekt Policijske postaje (PP) v Brežicah, na prostoru tovarne Jutranjka. na","Ob 8.50 nas bo muzejski vlak odpeljal z Jesenic, mimo Bleda in Bohinja proti končni postaji Kanal.",
"Barry je rekel, da bo v pelerini počakal na postaji in pomahal z baterijo, ko bo pripeljal avtobus, da ne bodo vsi do kože premočeni.","Ogled železnice: ZPM organizira obisk mariborske železniške postaje, kjer si bodo mladostniki ogledali lokomotive in se spoznali z delovanjem kretnic.",
"Malce brskajte po radijskih postajah, nekje ustavite frekvenco in vprašajte sopotnike, kdo prvi ugotovi izvajalca.","Režiserju in soustvarjalcem je uspelo v dobro poldrugo uro domišljeno zgoščenega, notranje intenzivnega in stopnjevanega dogajanja zaobjeti ključne postaje duševno ponotranjenega križevega pota »bivšega študenta« in nesrečnega morilca Rodiona Romanoviča Raskolnikova, in sicer od fragmentarno oživljenih družinskih oz. življenjskih okoliščin, ki so v medsebojnem družbenem součinkovanju (lahko) privedle do zločina, do posledičnega protagonistovega bolezenskega stanja, nenadzorovanih duševnih blodenj in telesnega trpljenja, ter njegovega zaključnega javnega priznanja zločina in (domnevnega) očiščenja.",
"naprava za sprejemanje in beleženje radijskih valov, ki jih oddajajo vesoljski radijski izviri; sestoji iz ene ali več anten, povezanih z ojačevalniki in sprejemniki; ti sprejeto valovanje vnesejo v računalnik, ki nato naredi sliko radijskega vira; antene radioteleskopov so podobne zrcalom reflektorjev in so včasih zares zelo velikih razsežnosti, premična antena raziskovalne postaje Jodrell Bank v Angliji ima npr. mrežasto kovinsko zrcalo s premerom 76 m, radioteleskop v Arecibu v Portoriku pa je vgrajen v žrelo ugaslega ognjenika in ima premer okoli 300 m, globino pa 50 m","Na varnem na postaji je ves pretresen povedal, da ga je napadel eden od majhnih dlakavih ljudi.",
"1974 - Kmetijsko veterinarski zavod Nova Gorica po priključitvi veterinarskih postaj: Vipava, Idrija, Nova Gorica ter v kasnejših letih še veterinarske postaje:Tolmin, Ajdovščina in Postojna",Na ranžirnem kolodvoru porazdelitve tveganja so posebno priljubljene postaje v »slabo razvitih provincialnih gnezdih«.,
"Mi smo se prve kilometre prevozili z najbolje opremljenim, ki ima ob 1,6-litrskem bencinskem motorju med drugim ABS, potovalni računalnik, lita platišča, radio, katerega evropska cena bo blizu 9000 evrov in na nekaj takega (zastopnik Renault-Nissan Slovenija bo uradne cene razkril te dni) bomo morali računati tudi pri nas.","Prevozil sem pol Evrope in našel marsikateri naslov, menda bom našel tudi ta servis.",
"S kolikšno povprečno hitrostjo bi moral voziti, da bi to razdaljo prevozil v 2 urah?","Sprint je sicer veleslalomu podobna disciplina, saj tekmovalci najprej prevozijo veleslalomsko progo.",
"Otok je ravno prav velik, da se ga lahko prevozi z avtom v enem dnevu.","Več kot 150 voznikov motornih koles, motorjev, osebnih avtomobilov, vojaških avtomobilov in celo tovornjakov je v deževnem vremenu prevozilo 172 km dolgo krožno pot po Pomurju in skozi obmejne kraje Madžarske, Hrvaške in Avstrije, zvečer pa so se zbrali na družabnem srečanju v Murski Soboti.",
"Da se povzpnemo za nekaj sto višinskih metrov, moramo neredko prevoziti sto in več kilometrov od doma do gora.","Ljudje, ki prevozijo manj kot 5000 kilometrov na leto, so še posebej izstopali s svojim neznanjem tako na teoretičnem kot na praktičnem področju.",
"Tam pred Dobravljami, na magistralki, ki jo vsak dan prevozim, je ravno tako ena takšna luknja.","Zaradi krajevnega policista in v moje veliko olajšanje je prestavil v nižjo in prevozil mestece z dovoljeno hitrostjo, brž ko je zadnja hiša ostala za nama, pa sva spet zdrvela.",
"On je neuspešno zahteval, da danes postavijo drugačno progo od tiste, ki so jo nekateri včeraj prevozili, jaz pa ne.","Za pobrat nucano blaguo bojo po foranijah naše pokrajine, an sevieda tudi v naši špietarski foraniji, pomagal “volontari”, pru takuo Kamuni, ki posodejo njih kamjone za prevozit blaguo od naših vasi do Čedada.",
"S 60 kW moči lahko proizvede najvišjo hitrost 45 km/h, s katero avtomobil prevozi do 2 km (način EV) ter tako dodatno varčuje z gorivom in ne sprošča emisij CO2.","Zakaj se je finomehanik Brane, človek iz bloka, odločil, da bo vsak dan kolesaril - Na Pance po kondicijo in v družbo - Tanja je kar bolna, če vsak dan ne prevozi vsaj dvajset kilometrov",
"Se vam zdi, da se danes ne vleče več kot neroden rep za nami miselnost, da je človek, ki da nekaj na obleko, modo in tudi skrb za urejen videz, v sebi bolj ali manj prazen?","Peniculus je pomanjševalnica besede penis (rep, penis) in pomeni hkrati 'repek', 'krtača', 'omelo' (bikov rep je služil za krtačo) in 'majhen penis'.",
"Lobanja je bila majhna, vrat in rep pa zelo dolga, zanj značilne so bile tudi š tiri zajetne noge.","Pregrešna vrtoglavica ustvarjalnosti, poneverjanja in kraje in izkrivljanja in spreminjanja, vse to je počel vznesen, vrtoglavo zadovoljen odrasel človek s svojo grozečo pokoro in z mačkom, ki opleta z repom.",
"Rep prek hrbta roke zavijte v zanko in pritrdite z veliko iglo, konec repa pa zavijte okrog gumice in dobro utrdite.","Tako je na primer seme solate lahko kaljivo še po treh letih, seme fižola, graha in špinače po dveh letih, repa in peteršilj pa kalita samo eno leto.",
"Lipidi v bioloških membranah tvorijo dvojno plast, ki je s polarnimi glavami usmerjena navzven in z nepolarnimi repi navznoter.","Brez svojega dragulja bi pozelenela od zavisti, napihnila bi se od zlobe, zrasli bi ti dlake, kremplji in kačji rep.",
"»Sprva smo si želeli, da bi Zavec izzval belgijskega evropskega prvaka Jacksona Oseija Bonsuja (24 zmag, 21 s k. o., 1 poraz), ki pa je stisnil rep med noge in odklonil obračun.",Bog jo je hitro zgrabil in ji odtrgal rep (iz njega je nato ustvaril Evo).,
"Eden od psov je koprneče prosil za pozornost, mahal je z repom in bil ves razburjen, zato sem se ustavila in ga popraskala po ušesih.","Prostorske razmere v slovenskih splošnih knjižnicah kažejo na velike razlike med mesti: Nova Gorica ima denimo na razpolago 83,5 kvadratnega metra na 1000 prebivalcev in je na prvem mestu, Maribor pa je z 22,5 m2 na 1000 prebivalcev povsem na repu med vsemi šestdesetimi slovenskimi splošnimi knjižnicami.",
"Komaj dve leti po volitvah se njegova stranka v javnomnenjskih raziskavah uvršča na sam rep lestvice političnih strank, člani Zaresa pa lahko skačejo od veselja, kadar jim kakšna anketa nameri več kot en odstotek podpore med volilci.","Na pogled je podoben rakunu, saj ima sivo in temnorjavo obročkast rep.",
"Že na prvem plovu sta se prekucnila, tako da sta odstopila.",Sredi pogajanj je Falcon odstopil z vladnega položaja in se upokojil.,
"V helenizmu se je vse spremenilo: književnost je hotela biti učena; ne zato, ker je bila prvič v zgodovini pridržana za elito (tudi Pindar in Ajshil nista bila ravno ljudska pisatelja): toda od svojega občinstva je zahtevala kulturni napor, ki je odlikoval ljubitelje; miti so tedaj odstopili prostor temu, čemur še zdaj pravimo mitologija in kar je preživelo do 18. stoletja.",Od pogodbe lahko odstopi v treh mesecih po začetku stečajnega postopka.,
