lema,stavek_1,stavek_2,oznaka (label)
neposredno,Do konstituiranja personalne komisije dajejo mnenja v razpisnih postopkih za mesto državnega tožilca neposredno višja tožilstva in javni tožilec Republike Slovenije.,"»isto nekaj drugega pa je bilo, ko je ZSSR podprla socialistično Kubo neposredno pred ameriškim pragom in tam skrivaj namestila rakete z jedrskimi konicami."
neposredno,"Večina pa je v obrazložitvi sprejela stališče, da bi se v tem primeru neposredno na podlagi 140. člena Ustave lahko odvijal proces delitve funkcij med lokalnimi skupnostmi in državo.","Pobudnikov pravni interes ni izkazan, saj izpodbijane določbe ZKP ne posegajo neposredno v pravice oziroma v pravni položaj pobudnika."
neposredno,"V zameno za to pretvarjajo plinasti dušik neposredno v oblike, ki jih rastlina lahko uporabi.","@Emonec se je tudi v komentarju 41 pokazal kot navaden lažnivec in lažnivi podtikovalec, ker jaz prav nikjer in nikjer v nobenem zapisu nisem ne neposredno in posredno izražal ljubezni do fažizma, klerikalizma in nacizma, kot mi podtakne in očita."
neposredno,"Zdi se, da tako starši otrok kot učitelji (oboji, bodisi posredno ali neposredno vplivajo na odločitev) razumejo, da so posamezne sistemske in vsebinske rešitve med seboj povezane in da odprtost, možnost izbire na ravni vsebin, s katerimi učitelji sledijo določenim ciljem, ter možnost izbire metod in oblik poučevanja učbenikov, »zahteva« povratno informacijo o otrokovem izkazanem znanju.","Pravi razlog je bil poskus, da bi ljudem bolj neposredno in iz drugega kota predstavili moža, ki veliko ve, pa ne samo zaradi svoje izobrazbe, položaja in življenjskih izkušenj, temveč tudi zato, ker ima redko sposobnost, da daljnosežno presoja najhujše zagate, v katerih se znajdeta družba in država, in celo ugane razvoj marsikakšnega dogodka."
odpovedati,Trata je ponavadi privlačna prav zaradi svoje razraščenosti torej se ji lahko v majhnem vrtu tudi odpoveste.,"Celo če je Çilit prestregel kak zlog ali dva, je šlo za izraz iz mladostniškega žargona, po katerem se najstniki vseh dežel in vseh dob poskušajo razlikovati od staršev, ne da bi se jim bilo treba obenem odpovedati uniformiranosti, ki jim daje samozavest in jih hkrati pomirja."
odpovedati,"Madrid je po zmagi slavil do jutranjih ur, Amsterdam pa je po tekmi z muko odpovedal načrtovano...","je sinoči na parkirišču pri Rdečem petelinu povedal, da je odpovedal službo, ker je dobil delo"
odpovedati,"Žal se je, kadar je do pričetka pouka manjkala le še sekunda, tudi sladkosneden gospodar odpovedal prehranjevalnim navadam, z obžalujočim pogledom pobožal polnjene palačinke na polici, hitro srknil požirek mleka in vrata hladilnika zaloputnil z obljubo, da bo vsebino v njem pospravil takoj po pričetku počitnic.","Odvetniški kandidat se izbriše iz imenika odvetniških kandidatov: 1. če izjavi, da ne želi več delati v odvetniški pisarni; 2. če odvetnik odpove pogodbo o zaposlitvi in odvetniški kandidat v roku osmih dni ne sklene pogodbe o zaposlitvi z drugim odvetnikom; 3. če se ugotovi, da ne izpolnjuje več z zakonom predpisanih pogojev za opravljanje dela odvetniškega kandidata; 4. če mu je izrečen disciplinski ukrep odvzema pravice opravljati delo v odvetniški pisarni."
odpovedati,"Če bi hoteli iti na boljšo fakulteto, bi se morali marsičemu odpovedati: službi za nedoločen čas, položaju ali plači, ali pa kakršni koli kombinaciji teh treh stvari.","To najemno razmerje pa ni varovano tako, kot so varovana stanovanjska najemna razmerja, saj ni določeno, da bi denacionalizacijski upravičenci morali skleniti z najemojemalci poslovnih prostorov najemno razmerje za nedoločen čas, ki bi ga lahko odpovedali le iz krivdnih razlogov."
odpovedati,"Bil je grd in star ta Žid, ... holokavst je preživel in potem v Rosetreejevi tovarni kolesarskih luči v Barranugliju vrta luknje v plošče ... in se spominja ljudi, nasproti katerim je bil odpovedal... številnih mej, pri katerih je le malo manjkalo, da jih ni prestopil), ko se stari Žid poslavlja od sveta, ta še kar žari -žarenje niti v smrti ne ugasne.","Nadškof je kmalu po imenovanju za pastirja tukajšnje škofije od župnije Sv. Stanislava zahteval, da se odpove svojemu posebnemu statusu, ki ji je omogočal, da sama upravlja s premoženjem."
odpovedati,"Ledvico lahko dobi celo prej, če najdejo primerne starše, da jih prepričajo, da se odpovedo oz. dajo izklopiti svojega otroka od aparatov.",Ta sporazum se lahko odpove po diplomatski poti s predhodnim devetdesetdnevnim obvestilom.
odpovedati,"Na šolah so odpovedali pouk, zaprli so vrtce, ulice so dobesedno prazne.","Berberskega princa Tarika Ibn Zijada je zaradi samovoljnosti njegov arabski vojaški poveljnik Musa Ibn Musair kaznoval z udarci, nekateri vojaški poveljniki pa so kalifu iz Damaska, za katerega so se udeležili pohoda v Španijo, odpovedali pokorščino."
odrezati,"Ker ji obveznosti med tednom odrežejo znaten kos časa, običajno med zobe ponese enostavne jedi.","»Spomni se, kaj se je zgodilo perzijskemu Velikemu kralju v času vdora v Grčijo: zgradil je most čez morje, da je spravil svojo vojsko čez Ožino, in s prekopom odrezal polotok z goro Atos, da je po njem priplulo njegovo ladjevje, potem pa je bil kaznovan za svojo nadustost in je doživel hude poraze tako na kopnem kot na morju.«"
odrezati,"Stebla nikoli ne odlomimo, temveč ga vedno odrežemo (skrajšamo) z ostrim nožem ali škarjami, ki morajo biti popolnoma čiste, da na rastlino ne zanesemo morebitnih bolezenskih klic.","FOTO 4: Odrežemo vse izrojene veje v notranjosti krošnje, ki zasenčujejo nižje ležeče vitalne rodne veje."
odrezati,"ja tm zadej a jo ne vidte aja sej res sliko so odrezal, zdej pa ne znajo več skp sestavt lol : )","»To je zato, ker si se pri informacijskem centru tako dobro odrezal!"
odrezati,"Nekateri nastopi so nam uspeli dobro, nekateri so bili povprečni in nekateri slabi, kot se je odrezala tudi večina nam konkurenčnih reprezentanc.","Irenine lase so kruto odrezali, jo prevezali tudi prek glave, da je zaslutil strahotne opekline pod bledimi povoji."
odrezati,"Lemmlina niso obsodili kot pobudnika in povzročitelja zločina, ampak kot juda, zato so ga obesili, služkinja je lagala, torej je morala bili kazen povezana z njenim grehom in so ji odrezali jezik, krščansko vdovo Mühleisin je svet sicer neusmiljeno obsodil na zazidanje pri živem telesu, vendar jo je vladar pomilostil.",Blago na notranjih vogalih odrežite in skozi odprtino blazino obrnite na lice.
odrezati,"Odrežemo cele skupine plodov in jih nekaj dni pustimo v hladilniku, nato jih za dan ali dva damo na sobno temperaturo.","Zanimivo bi bilo testirati, kako bi se odrezali tudi vsi ostali nekonformisti …"
odrezati,"Knjigo je končal leta 1997, založba pa mu jo zdaj objavlja v večen spomin na pisca, ki se je najbolj odrezal v življenjskem pripovedovanju o mejnih razpotjih.",Pri merjenju izpusta strupenih plinov so se avtomobili z bencinskim motorjem odrezali pričakovano bolje od dizelskih.
oster,"Kako postaviti senco, kolikšna je njena nasičenost in kako ostra naj bo, je stvar preizkušanja.","Lizbona – Volilni upravičenci na Portugalskem so na referendumu že drugič v manj kot desetletju odločali o omilitvi zakonodaje glede splavov, ki je sicer ena najostrejših v Evropi."
oster,"Gospod Cvenkelj me je prebodel s tako ostrim pogledom, da me je obšla slabost.","Prikličite si v zavest slike in spomine, ki vam predstavljajo element zraka: sprehod ob morju, med katerim se zaganja v vas oster veter, rahel poletni vetrič, ki premika drevesne krošnje, čisti zrak zgodaj zjutraj nekje na prostem v naravi."
oster,"Zahtevati nameravajo ostrejšo kontrolo govejega mesa, ki prihaja z britanskih otokov, da bi ugotovili, ali ni okuženo z boleznijo norih krav ali BSE.","Pred leti sem bil na dopustu v Črni gori z avtobusom in ko smo se vračali iz dopusta, je bilo zadnjih 100 km zelo kritičnih kar se vožnje šoferja avtobusa tiče, bila ga je cesta polna, ostri hitri zavoji da sem že ga hotel zamenjati za volanom, (sem poklicni šofer)!"
oster,"Ko sem fotografijo razvil, je bila tako ostra, da je vidna vsaka nitka na očetovem puloverju.","Dobavitelji morajo biti kvalitetni in zanesljivi, LIP in Jelovica sta pri tem uspela, v ostrem konkurenčnem boju pa seveda ni lahko vzdržati."
oster,6 Z ostrim nožem zarežemo okrog florentincev in jih poberemo s papirja za peko.,"VELENJE S tovornega avtomobila, ki ga je 45-letni D. J. iz Ljubljane vozil od Mislinje proti Velenju, je v ostrem ovinku pred Velenjem padel tovor."
oster,"Hranijo se z ribami, ki jih lovijo s svojimi dolgimi in ostrimi kljuni.","Sveta Brigita Švedska, ena največjih mističark poznega srednjega veka, pravi, da je Marija kot perunika čudoviti cvet ostrih listov, ki pomenijo bridko bolečino njenega srca."
oster,"Obenem pa je avtor mojster briljantnega, jasnega in jedrnatega dialoga, napolnjenega z nesentimentalnim humorjem in ostrim, na trenutke celo brutalnim tonom.","Še ostrejši je hrvaški poslanec Ivo Škrabalo: opozoril je, da je šel Jurgens v popolnoma napačno smer."
osvojitev,"Naj nam bo razsodnik zgodovina našega lastnega naroda. že več kakor 600 let od Osvojitve naprej se veselimo nepretrganega zapovrstja kraljev na prestolu, kar je veliko dlje, kot bi lahko obstajala katerakoli ljudska država.","Recimo, da so imeli templjarji načrt za osvojitev sveta in da so poznali skrivnost nekega neznanskega vira moči, skrivnost, za katero je bilo vredno žrtvovati vso četrt Templja v Parizu, komende, razsejane po vsem kraljestvu in v Španiji, na Portugalskem, v Angliji in Italiji, gradove v Sveti deželi, vse denarno bogastvo, skratka vse …"
osvojitev,"Osvojitev slednjih poteka prek čustvenih vezi, omogočajo pa ustrezno obliko odnosov.",Razstava nosi ime 60 let rokometa v Celju in podnaslov Od začetkov igranja rokometa in ustanovitve kluba do osvojitve naslova evropskih klubskih prvakov.
osvojitev,Darej je napravil velik načrt za osvojitev celotnega črnomorsko-kaspijskega področja od spodnje Donave do Jaksarta (Sir Darje) v srednji Aziji.,"Za Nymburk pa nisem rekel, da so slabi, nikakor pa niso favoriti za osvojitev lige."
osvojitev,"V prepričanju, da se vrednost osvajane dame odraža v trudu, ki ste ga vložili v osvojitev nasmeha ali poljuba.",Sredi aprila se je 1. zavezniška armada pod poveljstvom britanskega generala Kenetha Andersona pripravljala na osvojitev Tunisa.
osvojitev,"Kmalu po osvojitvi naslova sta namreč svetlolaso lepotičko, zase še vedno pravi, da je preprosto dekle iz Komende pri Ljubljani, opazila Alen Kobilica in agencija Bronz.","Osrednji del predmeta je posvečen osvojitvi osnovnih metod, orodij in gradnikov, ki jih potrebujemo, da lahko gradimo sisteme vodenja."
osvojitev,"Zaradi tega so se možnosti za osvojitev kolajne v moški konkurenci precej zmanjšale, vendar nismo obupali, temveč smo v vsako tekmo vložili vse naše adute.","Legendarna jugoslovanska alpinistična himalajska odprava Everest 1979, ki jo je vodil Tone Škarja, sestavljalo pa 25 vrhunskih alpinistov (21 iz Slovenije, 4 iz republik nekdanje Jugoslavije), si je za cilj zadala osvojitev vrha po nepreplezani, prvenstveni smeri po Zahodnem grebenu."
osvojitev,"Po osvojitvi naslova najlepše športnice Evrope je povedala, da si želi postati članica hrvaške reprezentance v rokometu, toda zdaj misli drugače.","Glavni aduti bodo zgodnje vstajanje, primerna obutev in oprema ter cilj: osvojitev izbranih vrhov."
zapreti,"Le mimogrede, zapori na Povšetovi ulici v Ljubljani ga še dandanšanji nimajo in nič ni slišati, da bi jih zato nameravali zapreti.",Spomladi od Višnje Gore do Bregane cestarji zaprli blizu 100 črnih priključkov na dolenjki - Ždinja vas želi legalizacijo črnega priključka - V vas višja vozila ne morejo - S tem bi tudi razbremenili center Novega mesta
zapreti,"V nediejo v Gorenjem Tarbiju se zapre Burnjak, ki je biu lietos buj liep, buj bogat s kulturno an z materialno ponudbo (od srečanj an koncertov do jabuk, kostanja an domačih dobruot, ki so jih skuhale an spekle sriedenjske gaspodinje), biu je tudi buj obiskan, saj je parklicu tudi vič ljudi ko vsa lieta nazaj tudi kadar nas je bluo na doplih po naših dolinah.",Desetarji se zaprejo v sobo in jih ni kakšnih deset minut na spregled.
zapreti,"V spalnici sem naletel na skrivnostne ribiške vrvice, za katere mislim, da so pripadale konstrukciji, ki mu je omogočala, da je spalnično okno zaprl iz postelje.","Kljub temu so pot nadaljevali, vendar so jih v Vicenzi zajeli, jim pobrali kovčke z denarjem, njih pa zaprli."
zapreti,"Kakšen bo izid, se še ne ve, vsekakor pa bi bila prava sramota zapreti muzej - ne glede na to, kako pomemben je.","Če človeku prinesemo hrano na mizo in ne bo jedel,potem je vse zaman.Budisti zaprejo vsa čutila zoper sodobnega sveta in se usmerijo k samemu sebi(kopija univerzalnega boga),da rastejo duhovno,ker na zunaj vlada kaos,velika iluzija napram božjem,pravijo ji Maha Maja."
zapreti,"Zaprl je težka mahagonijeva vrata, se malce odmaknil in jih pogledal.","sama pa je govorila za jeleno karleušo da ji gre na živce in da ponavlja za njo,in da naj se karleuša oglas takrat k bo napovnla dvorano tko k ona..no pa naj zdej zapre gobc kr ponavla skeno za jeleno karleušo"
zapreti,"Takoj sem zaprl vsa vrata in okna, prižgal svetilko, pobral papirje, jih uredil in pospravil na mizo.",Wallander se je s skodelico kave vrnil s svojo pisarno in zaprl vrata za sabo.
zapreti,"4 Strjenko nalijemo v vroče sterilizirane kozarce, jih zapremo ter postavimo v hladilnik.","Ko se predajate sladkostim odlične čokolade, drage dame, se jim prepustite popolnoma – zaprite oči in pustite, da se pregrešna dobrota v vaših ustih razširi po jeziku, se dotakne kar največ brbončic in še dolgo pusti čisti okus po užitku."
platforma,"Tako ena platforma ne zahteva povsem enake medosne razdalje, kaj šele celega vozila.","Kljub medosni razdalji 272,5 cm - peugeot 407 temelji na PSA-jevi platformi za velike avtomobile kot je na primer citroen C5 - je prostor dokaj omejen po višini, ob višjeraslem vozniku pa tudi za kolena."
platforma,"Javna platforma v skupnost združuje ustvarjalke in ustvarjalce različnih področij kreativnih industrij in umetnosti; fotografije, videofilma in animacije ter novih medijev.","ZA: Applov cenovno najdostopnejši prenosnik iBook je z Intelovo platformo dobil naslednika, ki sliši na ime MacBook."
platforma,"Zato je nelogična in neutemeljena njegova zahteva naročniku, da pri razvoju dovoli uporabo NET platforme, čeprav že iz njegovih revizijskih navedb izhaja, da NET platforma ni neodvisna od blagovne znamke dobaviteljev strojne opreme in operacijskih sistemov in programske opreme.","In umetnost je izbrala tudi Sašo Šavel, ustvarjalko oddaje Platforma, novinarko kulturne redakcije v naši hiši."
platforma,"Omrežje je platforma, na katero lahko obesimo prav vse tehnologije in vsebine.","Vlagatelj v revizijskih navedbah namreč navaja, da v kolikor bi naročnik imel operacijski sistem JAVA, bi bilo logično, da zahteva uporabo J2EE platforme, saj NET platforme ni mogoče uporabljati na JAVA operacijskih sistemih."
platforma,"Nič novega pravzaprav, saj je s takšnimi lepo zvenečimi in dovolj praznimi obljubami, ki si jih je z željami lahko napolnil vsak sprememb željni volivec, uspelo že marsikomu, zadnjič pa je s takšno politično »platformo« leta 1992 zmagal demokrat Bill Clinton.","Leta 1996 so med prvimi malimi podjetji pridobili standard kakovosti ISO 9001 in nadgradili razvojni oddelek, v katerem je nastal niz informacijskih platform za uporabo možnosti tehnologij, povezanih z mobilno telefonijo in telekomunikacijami."
platforma,Koncern je pionirsko pot za projekt s skupno platformo A00 prepustil Seatu z modelom Arosa.,»Oče mi je povedal… da iz kletnih prostorov vodijo navzgor… stopnice…po katerih so se svečeniki povzpeli na platformo…templja.«
platforma,"In v teh nekaj mesecih našega obstoja smo navezali stike z mnogimi inštitucijami in rada bi vas obvestila, da se zelo intenzivno pripravlja na evropskem nivoju neka organizacijska oblika, ki naj bi delovala v okviru Evropske unije, to je evropska platforma spomina in vesti, ki naj bi se ukvarjala s povezovanjem in sodelovanjem podobnih inštitucij kot je naša in naj bi prišlo do ustanovitve vseevropskega dokumentacijskega oziroma spominskega centra za žrtve vseh totalitarnih režimov.","B & N mora storitveno ponudbo razširiti tudi na druge naprave in seveda mobilne platforme, kakršni sta Windows Phone 7 in Moblin, saj bo samo tako svojim storitvam ustvaril dodano vrednost."
plašč,"Nad vrati sta visela star ribiški plašč in oguljen klobuk, obojega že dolgo ni nosil.","NHXCHXIzolacija in plašč iz omrežnege, brez halogenih elementov, mešanice po-limerov (HX)"
plašč,"2 Če imamo koga v bližini, skupaj z njim dobro podprimo pasje telo in ga premestimo na odejo ali plašč.","SLEKEL SI JE PLAŠČ, ODPRL OKNO IN POGLEDAL VEN V STARI VODNI STOLP."
plašč,"Glede na to, da srajce navadno ne nosite teden dni zapored, je dobro, da tudi plašč vsak mesec pregledate, ali ni morda že zrel za obisk kemične čistilnice.","Še preden je filma konec, zaključna špica se še ni odvrtela, Petra že vstaja in oblači plašč, medtem ko jaz med iztekajočimi napisi rad še malo pomolčim in razmislim kakšno malenkost, v glavi ponovim kakšen kader, kakšno sekvenco..."
plašč,"Zunaj lahko lije dež, lahko pridejo znanci v hladnih plaščih, ni se pripravljen niti premakniti.","Mimogrede je oplazila več starih plaščev, ki so togo viseli s kljuk, potem pa jo je grobo izvrglo na sorazmerno svetlobo."
plašč,"Kako je mraz, je zabrbrala in se zavila v ovratnik plašča.","Obleka Armani, Dunhill majica, kravata Versace, pas Ferragamo, Givenchy nogavice, Louis Voitton očala, Yves Saint Laurent plašč iz kašmirja in šal Burberry, vse ponaredki."
plašč,"Globine rovov ne moremo meriti, zato za ugotavljanje velikosti napake preštejemo število luknjic na plašču sortimenta.","Odločno je stala na svojem mestu, v bež salonarjih in rjavem plašču prek tenkega rumenega puloverja."
plašč,"Na ovratniku klasičnega volnenega plašča najdemo presenetljive robove, ostre srtaste vzorce na trenčkotu, v kolekciji pa so tudi lahkotne športne hlače za vsakdan.",S Haninega plašča je med prerivanjem ob Kurtovem prihodu odpadel še zadnji gumb in razkril pogled na raztrgano obleko pod njim.
podpirati,"To poglavje je idiosinkratičen poskus te zadnje vrste, ki ga za povrh ne podpira nobena posebna študija o Maorih ali filozofih (zlasti Hobbesu in Rousseauju), ki jih spotoma omenjam.","Varuh človekovih pravic Republike Slovenije se zaveda, da odgovorno obnašanje institucije vključuje tudi okolju prijazno poslovanje, zato podpira aktivnosti, ki vodijo k temu cilju."
podpirati,"Tudi zaradi zgodovinske in estetske vrednosti kandidatk podpiram njihovo članstvo, saj bi s tem prvič postali tudi bolj pozorni na kulturno dimenzijo Evrope, ki je bila doslej zanemarjena.","Gledamo širše, gremo v avstralijo, v Argentino in še kam, podpiramo Slovence širom sveta, ignoriramo Štajerce, Belokranjci so pa itak na pol Rvatje!"
podpirati,"Podpiram tudi to, da bi čimprej prišlo do oblikovanja in sprejemanja tega, kar bi se imenovalo nacionalni program izobraževanja odraslih in pa oblikovanje standardov in normativov za to dejavnost, ki bi omogočilo po eni strani lahko to, da bi se v to izobraževanje, še bolj kot doslej, vključevali tudi drugi, ne le na eni strani ljudske univerze, na drugi strani pa zasebniki z različnimi oblikami, ampak tudi drugi subjekti.","Služi kot razločevalec, kot vizualni označevalec kulturnih in družbenih razlik, v njem pa se odraža okolje z vsemi viri, ki so za izdelavo oblačil primerni in so na razpolago, v prepletu s tehničnim razvojem, ki podpira izdelavo oblačil, in s kulturnimi standardi, ki določajo praktične in estetske norme in ideje."
podpirati,"Tudi danes podpira levičarje, dal nam je Pahorja, ki že zaustavlja recesijo, ki so jo povzročili belčki. ***********************************************************************************************************************************","Imamo amandma odbora za finance in monetarno politiko, vlada ga podpira."
podpirati,starši morajo podpirati učenje otrok za šolo in komunikacijo med šolo in družino;,"Nekaj drugega bi pomenilo, če bi se scenaristom v stavki lahko pridružili tudi člani Združenja igralcev, ki jih ti sicer podpirajo, kar se je videlo tudi v njihovi odsotnosti na podelitvi globusov."
podpirati,"V konkretnem primeru ta ne podpira naročnikove namenske razlage pogoja, saj slednji ne zajema samo besedne zveze »skupna moč«, ki jo ločeno od preostalega besedila razlaga naročnik, ampak tudi v nadaljevanju pogoja podano besedilo »najmanj 2,5 MWel na objekt«.","Ukaz sndconfig uporablja za nastavljanje jedra, da podpira zvok naložljive module, ki se nahajajo v imeniku /lib/modules/2.0.31/misc."
podpirati,In kot so pokazale zadnje raziskave še vedno večina podpira gadafija saj je tudi vojska že skoraj prevzela oblast nad libijo...,"On: Obkroženi boste z osebami, ki bodo podpirale vaše ideje in načrte."
postaja,"1974 - Kmetijsko veterinarski zavod Nova Gorica po priključitvi veterinarskih postaj: Vipava, Idrija, Nova Gorica ter v kasnejših letih še veterinarske postaje:Tolmin, Ajdovščina in Postojna","Aleš uperi prst tudi proti nacionalki, ki prikazuje premalo oddaj z glasbo, ki ni narodnozabavna, in komercialnim radijskim postajam, ki se oglašujejo s tem, da predvajajo glasbo po željah poslušalcev."
postaja,"blejala pred postajo metroja, s postaje metroja, v postajo metroja, policisti so dajali luč s sireno in na trgu","Barry je rekel, da bo v pelerini počakal na postaji in pomahal z baterijo, ko bo pripeljal avtobus, da ne bodo vsi do kože premočeni."
postaja,"Na varnem na postaji je ves pretresen povedal, da ga je napadel eden od majhnih dlakavih ljudi.","Darko Gerjevič, ki je bil do sedaj komandir Policijske postaje Brežice, je prevzel naloge vodje Oddelka za splošne policijske naloge v Sektorju uniformirane policije na Policijski upravi Krško."
postaja,"Ob 8.50 nas bo muzejski vlak odpeljal z Jesenic, mimo Bleda in Bohinja proti končni postaji Kanal.","Ameriški igralec je večji del minule srede preživel na policijski postaji v severovzhodni ameriški državi Vermont, kamor so ga pripeljali zaradi prehitre vožnje."
postaja,"Ogled železnice: ZPM organizira obisk mariborske železniške postaje, kjer si bodo mladostniki ogledali lokomotive in se spoznali z delovanjem kretnic.",Na ranžirnem kolodvoru porazdelitve tveganja so posebno priljubljene postaje v »slabo razvitih provincialnih gnezdih«.
postaja,"Režiserju in soustvarjalcem je uspelo v dobro poldrugo uro domišljeno zgoščenega, notranje intenzivnega in stopnjevanega dogajanja zaobjeti ključne postaje duševno ponotranjenega križevega pota »bivšega študenta« in nesrečnega morilca Rodiona Romanoviča Raskolnikova, in sicer od fragmentarno oživljenih družinskih oz. življenjskih okoliščin, ki so v medsebojnem družbenem součinkovanju (lahko) privedle do zločina, do posledičnega protagonistovega bolezenskega stanja, nenadzorovanih duševnih blodenj in telesnega trpljenja, ter njegovega zaključnega javnega priznanja zločina in (domnevnega) očiščenja.","naprava za sprejemanje in beleženje radijskih valov, ki jih oddajajo vesoljski radijski izviri; sestoji iz ene ali več anten, povezanih z ojačevalniki in sprejemniki; ti sprejeto valovanje vnesejo v računalnik, ki nato naredi sliko radijskega vira; antene radioteleskopov so podobne zrcalom reflektorjev in so včasih zares zelo velikih razsežnosti, premična antena raziskovalne postaje Jodrell Bank v Angliji ima npr. mrežasto kovinsko zrcalo s premerom 76 m, radioteleskop v Arecibu v Portoriku pa je vgrajen v žrelo ugaslega ognjenika in ima premer okoli 300 m, globino pa 50 m"
postaja,"s tem namenom je zgrajen nov objekt Policijske postaje (PP) v Brežicah, na prostoru tovarne Jutranjka. na","Čeprav prvotno zbornica ni imela tovrstnih namenov, saj bi našim strokovnim službam, testnim postajam in osemenjevalnim centrom ustrezala trdna pogodba z krovno govedorejsko organizacijo o izvajanju nalog na tem področju, pa je sedaj zaradi odgovornosti, ki jo imamo pred vsemi Vami in tudi drugimi člani, to obvezana narediti."
prevoziti,"Prevozil sem pol Evrope in našel marsikateri naslov, menda bom našel tudi ta servis.","Zakaj se je finomehanik Brane, človek iz bloka, odločil, da bo vsak dan kolesaril - Na Pance po kondicijo in v družbo - Tanja je kar bolna, če vsak dan ne prevozi vsaj dvajset kilometrov"
prevoziti,"Zaradi krajevnega policista in v moje veliko olajšanje je prestavil v nižjo in prevozil mestece z dovoljeno hitrostjo, brž ko je zadnja hiša ostala za nama, pa sva spet zdrvela.","Sprint je sicer veleslalomu podobna disciplina, saj tekmovalci najprej prevozijo veleslalomsko progo."
prevoziti,"Več kot 150 voznikov motornih koles, motorjev, osebnih avtomobilov, vojaških avtomobilov in celo tovornjakov je v deževnem vremenu prevozilo 172 km dolgo krožno pot po Pomurju in skozi obmejne kraje Madžarske, Hrvaške in Avstrije, zvečer pa so se zbrali na družabnem srečanju v Murski Soboti.","Ljudje, ki prevozijo manj kot 5000 kilometrov na leto, so še posebej izstopali s svojim neznanjem tako na teoretičnem kot na praktičnem področju."
prevoziti,Ta ovinek je del šprinterske proge in so ga športniki in športnice prevozili velikokrat že pred začetkom olimpijskih iger.,"S 60 kW moči lahko proizvede najvišjo hitrost 45 km/h, s katero avtomobil prevozi do 2 km (način EV) ter tako dodatno varčuje z gorivom in ne sprošča emisij CO2."
